{
  "$generated": true,
  "$source": "pipeline-derived",
  "$schema": "./currencies.schema.json",
  "$note": "TIER 2 codegen-ready spec — produced by the geo data pipeline from contracts/geo/src-data/*.spec.json (Tier 1). Matches the canonical entity record shape; consumed directly by codegen (.NET SourceGen + TS emitter — Tier 3) to produce concrete entity types. Do NOT hand-edit — re-run `pnpm geo:refresh` to regenerate. IsSupported derived from contracts/messages/*.json file presence — selectable locales' primary countries' primary currencies. Active set: 10 selectable locales -> derived 6 supported currencies.",
  "catalogVersion": "0.1.0",
  "generatedAt": "2026-10-21T06:05:33.378Z",
  "entries": [
    {
      "iso4217AlphaCode": "ADP",
      "iso4217NumericCode": "020",
      "displayName": "Andorran Peseta",
      "decimalPlaces": 0,
      "symbol": null,
      "isActive": false,
      "isSupported": false
    },
    {
      "iso4217AlphaCode": "AED",
      "iso4217NumericCode": "784",
      "displayName": "United Arab Emirates Dirham",
      "decimalPlaces": 2,
      "symbol": "AED",
      "isActive": true,
      "isSupported": false
    },
    {
      "iso4217AlphaCode": "AFA",
      "iso4217NumericCode": "004",
      "displayName": "Afghan Afghani (1927–2002)",
      "decimalPlaces": 2,
      "symbol": null,
      "isActive": false,
      "isSupported": false
    },
    {
      "iso4217AlphaCode": "AFN",
      "iso4217NumericCode": "971",
      "displayName": "Afghan Afghani",
      "decimalPlaces": 0,
      "symbol": "؋",
      "isActive": true,
      "isSupported": false
    },
    {
      "iso4217AlphaCode": "ALK",
      "iso4217NumericCode": "008",
      "displayName": "Albanian Lek (1946–1965)",
      "decimalPlaces": 2,
      "symbol": null,
      "isActive": false,
      "isSupported": false
    },
    {
      "iso4217AlphaCode": "ALL",
      "iso4217NumericCode": "008",
      "displayName": "Albanian Lek",
      "decimalPlaces": 0,
      "symbol": "ALL",
      "isActive": true,
      "isSupported": false
    },
    {
      "iso4217AlphaCode": "AMD",
      "iso4217NumericCode": "051",
      "displayName": "Armenian Dram",
      "decimalPlaces": 2,
      "symbol": "֏",
      "isActive": true,
      "isSupported": false
    },
    {
      "iso4217AlphaCode": "ANG",
      "iso4217NumericCode": "532",
      "displayName": "Netherlands Antillean Guilder",
      "decimalPlaces": 2,
      "symbol": "ANG",
      "isActive": false,
      "isSupported": false
    },
    {
      "iso4217AlphaCode": "AOA",
      "iso4217NumericCode": "973",
      "displayName": "Angolan Kwanza",
      "decimalPlaces": 2,
      "symbol": "Kz",
      "isActive": true,
      "isSupported": false
    },
    {
      "iso4217AlphaCode": "AOK",
      "iso4217NumericCode": "024",
      "displayName": "Angolan Kwanza (1977–1991)",
      "decimalPlaces": 2,
      "symbol": null,
      "isActive": false,
      "isSupported": false
    },
    {
      "iso4217AlphaCode": "AON",
      "iso4217NumericCode": "024",
      "displayName": "Angolan New Kwanza (1990–2000)",
      "decimalPlaces": 2,
      "symbol": null,
      "isActive": false,
      "isSupported": false
    },
    {
      "iso4217AlphaCode": "AOR",
      "iso4217NumericCode": "982",
      "displayName": "Angolan Readjusted Kwanza (1995–1999)",
      "decimalPlaces": 2,
      "symbol": null,
      "isActive": false,
      "isSupported": false
    },
    {
      "iso4217AlphaCode": "ARA",
      "iso4217NumericCode": "032",
      "displayName": "Argentine Austral",
      "decimalPlaces": 2,
      "symbol": null,
      "isActive": false,
      "isSupported": false
    },
    {
      "iso4217AlphaCode": "ARL",
      "iso4217NumericCode": null,
      "displayName": "Argentine Peso Ley (1970–1983)",
      "decimalPlaces": 2,
      "symbol": null,
      "isActive": false,
      "isSupported": false
    },
    {
      "iso4217AlphaCode": "ARM",
      "iso4217NumericCode": null,
      "displayName": "Argentine Peso (1881–1970)",
      "decimalPlaces": 2,
      "symbol": null,
      "isActive": false,
      "isSupported": false
    },
    {
      "iso4217AlphaCode": "ARP",
      "iso4217NumericCode": "032",
      "displayName": "Argentine Peso (1983–1985)",
      "decimalPlaces": 2,
      "symbol": null,
      "isActive": false,
      "isSupported": false
    },
    {
      "iso4217AlphaCode": "ARS",
      "iso4217NumericCode": "032",
      "displayName": "Argentine Peso",
      "decimalPlaces": 2,
      "symbol": "$",
      "isActive": true,
      "isSupported": false
    },
    {
      "iso4217AlphaCode": "ARY",
      "iso4217NumericCode": "032",
      "displayName": "Peso",
      "decimalPlaces": 2,
      "symbol": null,
      "isActive": false,
      "isSupported": false
    },
    {
      "iso4217AlphaCode": "ATS",
      "iso4217NumericCode": "040",
      "displayName": "Austrian Schilling",
      "decimalPlaces": 2,
      "symbol": null,
      "isActive": false,
      "isSupported": false
    },
    {
      "iso4217AlphaCode": "AUD",
      "iso4217NumericCode": "036",
      "displayName": "Australian Dollar",
      "decimalPlaces": 2,
      "symbol": "$",
      "isActive": true,
      "isSupported": false
    },
    {
      "iso4217AlphaCode": "AWG",
      "iso4217NumericCode": "533",
      "displayName": "Aruban Florin",
      "decimalPlaces": 2,
      "symbol": "AWG",
      "isActive": true,
      "isSupported": false
    },
    {
      "iso4217AlphaCode": "AYM",
      "iso4217NumericCode": "945",
      "displayName": "Azerbaijan Manat",
      "decimalPlaces": 2,
      "symbol": null,
      "isActive": false,
      "isSupported": false
    },
    {
      "iso4217AlphaCode": "AZM",
      "iso4217NumericCode": "031",
      "displayName": "Azerbaijani Manat (1993–2006)",
      "decimalPlaces": 2,
      "symbol": null,
      "isActive": false,
      "isSupported": false
    },
    {
      "iso4217AlphaCode": "AZN",
      "iso4217NumericCode": "944",
      "displayName": "Azerbaijani Manat",
      "decimalPlaces": 2,
      "symbol": "₼",
      "isActive": true,
      "isSupported": false
    },
    {
      "iso4217AlphaCode": "BAD",
      "iso4217NumericCode": "070",
      "displayName": "Bosnia-Herzegovina Dinar (1992–1994)",
      "decimalPlaces": 2,
      "symbol": null,
      "isActive": false,
      "isSupported": false
    },
    {
      "iso4217AlphaCode": "BAM",
      "iso4217NumericCode": "977",
      "displayName": "Bosnia-Herzegovina Convertible Mark",
      "decimalPlaces": 2,
      "symbol": "KM",
      "isActive": true,
      "isSupported": false
    },
    {
      "iso4217AlphaCode": "BAN",
      "iso4217NumericCode": null,
      "displayName": "Bosnia-Herzegovina New Dinar (1994–1997)",
      "decimalPlaces": 2,
      "symbol": null,
      "isActive": false,
      "isSupported": false
    },
    {
      "iso4217AlphaCode": "BBD",
      "iso4217NumericCode": "052",
      "displayName": "Barbadian Dollar",
      "decimalPlaces": 2,
      "symbol": "$",
      "isActive": true,
      "isSupported": false
    },
    {
      "iso4217AlphaCode": "BDT",
      "iso4217NumericCode": "050",
      "displayName": "Bangladeshi Taka",
      "decimalPlaces": 2,
      "symbol": "৳",
      "isActive": true,
      "isSupported": false
    },
    {
      "iso4217AlphaCode": "BEC",
      "iso4217NumericCode": "993",
      "displayName": "Belgian Franc (convertible)",
      "decimalPlaces": 2,
      "symbol": null,
      "isActive": false,
      "isSupported": false
    },
    {
      "iso4217AlphaCode": "BEF",
      "iso4217NumericCode": "056",
      "displayName": "Belgian Franc",
      "decimalPlaces": 2,
      "symbol": null,
      "isActive": false,
      "isSupported": false
    },
    {
      "iso4217AlphaCode": "BEL",
      "iso4217NumericCode": "992",
      "displayName": "Belgian Franc (financial)",
      "decimalPlaces": 2,
      "symbol": null,
      "isActive": false,
      "isSupported": false
    },
    {
      "iso4217AlphaCode": "BGJ",
      "iso4217NumericCode": "100",
      "displayName": "Lev A/52",
      "decimalPlaces": 2,
      "symbol": null,
      "isActive": false,
      "isSupported": false
    },
    {
      "iso4217AlphaCode": "BGK",
      "iso4217NumericCode": "100",
      "displayName": "Lev A/62",
      "decimalPlaces": 2,
      "symbol": null,
      "isActive": false,
      "isSupported": false
    },
    {
      "iso4217AlphaCode": "BGL",
      "iso4217NumericCode": "100",
      "displayName": "Bulgarian Hard Lev",
      "decimalPlaces": 2,
      "symbol": null,
      "isActive": false,
      "isSupported": false
    },
    {
      "iso4217AlphaCode": "BGM",
      "iso4217NumericCode": null,
      "displayName": "Bulgarian Socialist Lev",
      "decimalPlaces": 2,
      "symbol": null,
      "isActive": false,
      "isSupported": false
    },
    {
      "iso4217AlphaCode": "BGN",
      "iso4217NumericCode": "975",
      "displayName": "Bulgarian Lev",
      "decimalPlaces": 2,
      "symbol": "BGN",
      "isActive": false,
      "isSupported": false
    },
    {
      "iso4217AlphaCode": "BGO",
      "iso4217NumericCode": null,
      "displayName": "Bulgarian Lev (1879–1952)",
      "decimalPlaces": 2,
      "symbol": null,
      "isActive": false,
      "isSupported": false
    },
    {
      "iso4217AlphaCode": "BHD",
      "iso4217NumericCode": "048",
      "displayName": "Bahraini Dinar",
      "decimalPlaces": 3,
      "symbol": "BHD",
      "isActive": true,
      "isSupported": false
    },
    {
      "iso4217AlphaCode": "BIF",
      "iso4217NumericCode": "108",
      "displayName": "Burundian Franc",
      "decimalPlaces": 0,
      "symbol": "BIF",
      "isActive": true,
      "isSupported": false
    },
    {
      "iso4217AlphaCode": "BMD",
      "iso4217NumericCode": "060",
      "displayName": "Bermudan Dollar",
      "decimalPlaces": 2,
      "symbol": "$",
      "isActive": true,
      "isSupported": false
    },
    {